,author_id,title,country,reviews,date,total_reviews_written,upvote,reviewer_name,ratings,start_time,end_time,companyName,scraped_site
0,60b0f855f9f4870a94afc9d5,From picking the goods on time to…,US,"From picking the goods on time to delivering it to the warehouse on time and that on or before time, Coshipper works best. Happy client!",2021-05-28T14:04:05.000Z,7,0,Garcia Charles D.,5.0,2021-05-28 13:36:05.646874,2021-05-28 13:36:06.974805,Coshipper,Trustpilot
1,60a4fde1f9f4870b700830a7,We were panicked when demand for our…,US,We were panicked when demand for our household products increased all of a sudden amid this pandemic. Thanks to Coshipper. Their professional has been managing entire shippings so well. No complaints at all. HAve another 2 LCL's on their way out to east and west centers..,2021-05-19T12:00:33.000Z,2,0,Dorothy Beltran,5.0,2021-05-28 13:36:06.974805,2021-05-28 13:36:08.175258,Coshipper,Trustpilot
2,609bc901f9f4870a949ff628,We have been with Coshipper services…,US,"We have been with Coshipper services for a year now for delivering the bulk textiles from china into eu and us, and we were never disappointed. Hope to get such services in future as well.",2021-05-12T12:24:33.000Z,6,0,Norma Wortman,5.0,2021-05-28 13:36:08.175258,2021-05-28 13:36:09.356829,Coshipper,Trustpilot
3,6093e97cf9f4870a7870485e,Coshipper offered competence charges,US,Coshipper offered competence charges. Also they were clearly communicated about the clearance issues.,2021-05-06T13:05:00.000Z,1,0,Molly Ferguson,5.0,2021-05-28 13:36:09.356829,2021-05-28 13:36:10.559394,Coshipper,Trustpilot
4,6090d50df9f4870a786d833f,I migrated from my previous company coz…,US,"I migrated from my previous company coz of communication issues. Fortunately, that’s not the case here. Coshipper team is professional and always lets me speak to the right person. Needles to say, inventories also reached my amazon's warehouse on scheduled time.",2021-05-04T05:01:01.000Z,2,0,Luella Jacobs,5.0,2021-05-28 13:36:10.559394,2021-05-28 13:36:14.772652,Coshipper,Trustpilot
5,608bbfa6f9f487051034310e,Successfully shipped all orders.,US,Professional team of Coshipper came as godsend when I couldn’t find a vendor for urgent covid supplies. They successfully shipped all the orders on time. Tysm.,2021-04-30T08:28:22.000Z,3,0,Danny,5.0,2021-05-28 13:36:14.772652,2021-05-28 13:36:16.979406,Coshipper,Trustpilot
6,608ab4bef9f4870510336c29,Coshipper has been a true gem for my…,US,"Coshipper has been a true gem for my recent shipment of China to the US. They disclosed possible troubles in advance, thus making me feel all comfortable. Wanna keep them as our permanent forwarding provider!",2021-04-29T13:29:34.000Z,2,0,Myrna,5.0,2021-05-28 13:36:16.979406,2021-05-28 13:36:17.145637,Coshipper,Trustpilot
7,60801f2ff9f48709006873fe,Such excellent teamwork and…,US,"Such excellent teamwork and coordination at shipping my goods overseas within the estimated time! Some exceptions on shipping time with delays recently due to port blockage at LA (but isnt everyone...) but I am pleased by their customer support team, they kept me updated throughout the entire shipment and were extra careful with the items that were being shipped. Cool job, guys!",2021-04-21T12:48:47.000Z,5,0,Juan Phillips,5.0,2021-05-28 13:36:17.145637,2021-05-28 13:36:18.345138,Coshipper,Trustpilot
8,606f9696f85d7508705122c0,what you need to know????,RS,,2021-04-08T23:49:42.000Z,7,0,Bojan Petrovic,5.0,2021-05-28 13:36:18.345138,2021-05-28 13:36:18.534657,Coshipper,Trustpilot
9,6066d641f85d75087043e232,Reliable shipping services,US,"Reliable shipping services, especially for overseas ones.....teamwork is great and and helps me with many questions which I was afraid of as first time sending goods to USA. Thank you for the on-time delivery and cost-effective estimate.",2021-04-02T08:30:57.000Z,3,0,Michael Webb,5.0,2021-05-28 13:36:18.534657,2021-05-28 13:36:20.747216,Coshipper,Trustpilot
10,60644a1bf85d7508703fa7cd,Coshipper shipped the goods with great…,US,Coshipper shipped the goods with great care and made sure that no harm is done to the sensitive products.,2021-03-31T10:08:27.000Z,6,0,Timothy Harward,5.0,2021-05-28 13:36:20.747216,2021-05-28 13:36:21.976887,Coshipper,Trustpilot
11,605af746f85d7507e41f3e2a,Their 15 day fast boat service took…,US,"Their 15 day fast boat service took more than 50 days door to door.

Good communication. Outright lie on shipping time. Getva money back guarsntee if they give toy a date promise.",2021-03-24T08:24:38.000Z,1,0,Ins Pro,3.0,2021-05-28 13:36:21.976887,2021-05-28 13:36:25.155271,Coshipper,Trustpilot
12,605aea3cf85d750870320a07,Company cares about clients,US,"Company cares about clients, including newbies. Could also inform me about 03 hours shipment delay due to warehouse formalities.",2021-03-24T07:29:00.000Z,3,0,Hung Hubley,5.0,2021-05-28 13:36:25.155271,2021-05-28 13:36:28.383818,Coshipper,Trustpilot
13,6059cb6ef85d750870311c31,Considering that our company is fickle…,US,"Considering that our company is fickle about our in stock rates for fast moving products, we can’t simply afford to ignore Coshipper at any stage. Their brilliant team goes a few extra miles to get shipments done with perfection. Have no issues at all!",2021-03-23T11:05:18.000Z,6,0,Mark Baldwin,5.0,2021-05-28 13:36:28.383818,2021-05-28 13:36:32.695098,Coshipper,Trustpilot
14,60519fe1f85d7503942cae23,Last few shipments were done on time,US,"Last few shipments were done on time, every goods item was shifted without damage. The best thing, the support team was on track with me to keep me updated with the process.",2021-03-17T06:21:21.000Z,3,0,Russel Diu,5.0,2021-05-28 13:36:32.695098,2021-05-28 13:36:32.895389,Coshipper,Trustpilot
15,60512b95f85d75064c439cab,I needed someone to export latex products and import potato chips and Kel Varnsen didn't let me down!,US,Great company! Couldn't say enough good things about the gentleman in charge of the place. His name was George Costanza. He said he was an importer and an exporter. I was blown away by that statement. I had always thought you had to be one or the other. An importer or an exporter but not both. He said he did both. At a place called Vandelay Industries. Yeah that's right. I believe he imported latex products and exported I think potato chips...might be wrong about the chips. I'm not sure what it was but he did both jobs. He worked with a fellow by the name of Kel Varnsen. Great bunch of people they have working over there at Vandelay,2021-03-16T22:05:09.000Z,4,0,Stat Albert,5.0,2021-05-28 13:36:32.895389,2021-05-28 13:36:35.105487,Coshipper,Trustpilot
16,6050453cf85d75064c42a208,The fantastic friendly team at…,US,"The fantastic friendly team at Coshipper has helped us out all the way. From china's local shipping of the goods on time to providing a competitive quote, Coshipper has actually done a great job. Thumbs up. Only thing i would recommend them is to get better at tracking.",2021-03-16T05:42:20.000Z,5,0,Debbie Cruz,5.0,2021-05-28 13:36:35.105487,2021-05-28 13:36:35.311448,Coshipper,Trustpilot
17,604b4cdff85d75064c3f59e5,It was actually a better cost saving…,US,"It was actually a better cost saving for us to go with Coshipper which got us the best price and A1 service., instead of Flexport. 5 stars.",2021-03-12T11:13:35.000Z,3,0,Jessica Wetherby,5.0,2021-05-28 13:36:35.311448,2021-05-28 13:36:37.517833,Coshipper,Trustpilot
18,60346f7ff85d750b989daaf8,Their services are highly appreciated,US,"Their services are highly appreciated. Are there hiccups sometimes, yes, but honestly if you've been in the import and export business for any reasonable period of time, you'll know that these guys are at the top of their game and offer truly something really different.",2021-02-23T02:59:11.000Z,1,0,wINTER Leung,3.0,2021-05-28 13:36:37.517833,2021-05-28 13:36:37.664442,Coshipper,Trustpilot
19,60253c93679d97052cd484cd,Been a private label seller,US,"Been a private label seller since 2015. Found coshipper a year ago and they have taken great care of all of our supply chain and shipping needs, so we can now focus better on growing business. All our inventories have been moved with great care and zero damage until now. Hoping the same services for future as well. And, their charges are competitive as compared to other similar companies. Time wise, it’s as expected: A few days off estimated transit times and delays at customs, but come on people, did you not realize there’s an pandemic! This is why you plan your inventory and arrange your supplies restock schedules ahead of time with sufficient buffer. “Just in time inventory” planning is not gonna work when there’s a global disease that’s killed close to 500k people here in the US, and impacted millions. If you think your suppliers or service providers are responsible for keeping your products in stock in light of what’s happening, I’m sorry Buddy, but no - it’s your problem. Delays are gonna happen, so my advice to fellow sellers is to change how your planning your inventory and your restock times to account for a changing world. rant over",2021-02-11T14:17:55.000Z,3,0,Robert Gillam,5.0,2021-05-28 13:36:37.664442,2021-05-28 13:36:37.822021,Coshipper,Trustpilot
20,60229d2a679d97052cd21d33,Thumbs up.,US,"My first ever shipment from USA to China was done via coshipper without any trouble. My account manger was Jaelyn and was very prompt on not only updates, but suggestions on how to revise my packaging and shipping routes to minimize costs and other things. I got my shipment confirmation from Jaelyn after payment and it was honestly a big relief. Keep helping like this!!",2021-02-09T14:33:14.000Z,9,0,Leanna O.,5.0,2021-05-28 13:36:41.062789,2021-05-28 13:36:44.318524,Coshipper,Trustpilot
21,601528e5679d9705c85e6e3a,Coshipper has really helped,US,"Coshipper has really helped my Amazon european business to grow. I feel great ease discussing things with Jason coz he never feels annoyed with my random queries. Company is like one-stop solution for moving my FBA inventors into multiple countries, including Europe and UK even with the brexit and new customs borders.",2021-01-30T09:37:41.000Z,5,0,Francisco Cox,5.0,2021-05-28 13:36:44.318524,2021-05-28 13:36:46.526437,Coshipper,Trustpilot
22,6012ab05679d9701d07b3605,Coshipper delivered our LCL,US,"Coshipper delivered our LCL ocean on time. Their services are highly appreciated. Also, there was no damage done to the products.",2021-01-28T12:16:05.000Z,5,0,Myra Smith,5.0,2021-05-28 13:36:46.526437,2021-05-28 13:36:48.760341,Coshipper,Trustpilot
23,6011bd8f679d9705c85ba4bb,"BUYER BEWARE. Take a look at their ""positive"" reviews and the reviewers that left them",US,"TWO extremely poor experiences with Coshipper for my shipment from China to USA. Their quotes for their transit times are as true as unicorns and fairies. They may be listed on Amazon's vendors list for shipping but trust that it won't be long - they are absolutely the worst shipping service you could pick. Do not say you weren't warned - they will give you the runaround for any status you ask for after you pay (they do not provide third party tracking, just their own manual tracking which they update with any info as they please). Plagued with dishonesty and confusion, they do not take ANY responsibility for their poor services.

Here are some excuses (I received all 4) you may hear when the goods have not been delivered. Mind you they picked up the goods in SEPTEMBER 2020 and this is in JANUARY 2021:
1. We are unable to make a delivery appointment. We have been urging every day
2. The goods have already been delivered. When asked the date, they then realize it hasn't been delivered
3. The goods need to be dismantled from the shelf
4. The goods were stuck in customs for weeks causing delay

As another reviewer said, DO NOT FALL FOR IT! We have since disputed the payment on PayPal as they have lost all credibility. They are now trying to ask me to wire them more money directly to their bank account. What a nightmare. It will be an expensive and frustrating lesson for you. Don't learn the hard way.",2021-02-12T17:30:19.000Z,1,0,Cindy M,1.0,2021-05-28 13:36:48.760341,2021-05-28 13:36:51.958899,Coshipper,Trustpilot
24,600abade755dc104c0c5968a,The staff is amazing,US,The staff is amazing! Very helpful and considerate with a sense of urgency. Loads are 99% on time and the rates are very competitive. I look forward to doing business with them for many years to come.,2021-01-22T11:45:34.000Z,3,0,Lester Wu,5.0,2021-05-28 13:36:51.958899,2021-05-28 13:36:53.146705,Coshipper,Trustpilot
25,60081c32755dc109e8dfe55e,5 stars!!!,US,Your team worked magnificently all through the year and especially at year-end......Glad that I trusted y'all for handling my shipments. 5 stars!!!,2021-01-20T12:04:02.000Z,7,0,Issac Hill,5.0,2021-05-28 13:36:53.146705,2021-05-28 13:36:54.341615,Coshipper,Trustpilot
26,60003609755dc109d844d9ab,"The best international shipping service, I must say.",US,Sending goods from GZ for a long time. Every shipment has reached to the destinations as scheduled with just a few delays. Thank you Henry for sending the shipment details as well and keeping me updated. Wish covid can be over!!,2021-01-14T12:16:09.000Z,8,0,Tessa Bell,5.0,2021-05-28 13:36:54.341615,2021-05-28 13:36:55.518431,Coshipper,Trustpilot
27,5ffd8667755dc1032c136c3b,Coshipper always does the sourcing,US,"Coshipper always does the sourcing (yes, they helped me find some products and contracted out to the factories directly) and the logistics part of shipment of our products to Amazon warehouses straight out from China + splitting shipment to a few of my client's large warehouses (for further distribution) in the US. Their services are highly appreciated. Are there hiccups sometimes, yes, but honestly if you've been in the import and export business for any reasonable period of time (8 years for myself), you'll know that these guys are at the top of their game and offer truly something really different.

Also a tip, I've asked them to QC for any damages to my products before they ship out, and there have been no damages due to transit to the products either so far. My advise to some is to make sure you get the best packaging possible at the manufacture side, and to make sure QC is done before you ship out or else its very hard to find the ones accountable as your distributors or end customers are gonna complain to you if and when truth hits the fan. Coshipper side, 5/5.",2021-01-12T11:22:15.000Z,7,0,Ed Austin,5.0,2021-05-28 13:36:55.518431,2021-05-28 13:36:58.748218,Coshipper,Trustpilot
28,5ff83ce9755dc1032c0f9211,Delayed delivery - damaged goods - Horrible experience and big loss,FR,I had a really bad experience with Coshipper for my shipment from China to France. The shipment arrived damaged (on top of being delayed by over a month) and Coshipper did not want to take responsibility for it inspite of having shipping insurance. What's worse is that they stopped responding to my questions/requets through multiple communication channels. We had a big financial loss and it's sad to see that such unprofessional companies are still fooling people. DON'T FALL FOR THE TRAP.,2021-01-08T11:07:21.000Z,1,0,Samad,1.0,2021-05-28 13:36:58.748218,2021-05-28 13:37:02.932374,Coshipper,Trustpilot
29,5ff8331f755dc1032c0f86c2,Excellent shipping service,US,"My entire experience from the first call with the Coshipper team, to the final long haul delivery was personal, professional, and very positive. If this is what you are looking for, you found it. Happy with the excellent shipping service.",2021-01-08T10:25:35.000Z,5,0,Sandra Hoffman,5.0,2021-05-28 13:37:02.932374,2021-05-28 13:37:04.124314,Coshipper,Trustpilot
30,5ff58e4c755dc1032c0d58a0,5 stars without any doubt,US,"We appreciate your team’s efforts in getting the urgent air shipment and addressing the customs approval bottleneck. We are confident that Coshipper will always have the solution to every difficult situation, to better our services to customers. We thank you for all your assistance. 5 stars without any doubt.",2021-01-06T10:17:48.000Z,6,0,Norman Smith,5.0,2021-05-28 13:37:04.124314,2021-05-28 13:37:04.292011,Coshipper,Trustpilot
31,5ff52338755dc1032c0d2748,DO NOT TRUST,CA,"DO NOT TRUST.

Paid an extraordinary sum of money to get the products delivered to the final destination. It has been 2 months passed the promised delivery date and all the products have still not been delivered.

Customer service is extremely poor, with most days no answer. They do not respond back in a timely manner.

Lost a large sum of money because of their negligence.

Save yourself the despair and DO NOT work with this company. Lawsuit on its way.",2021-01-06T02:40:56.000Z,1,0,Qais Sahel,1.0,2021-05-28 13:37:04.292011,2021-05-28 13:37:06.506034,Coshipper,Trustpilot
32,5ff2eb72755dc107e0d65b1d,I haven’t booked such a fast shipping service,US,"I haven’t booked such a fast shipping service for a long time. Coshipper handled all the deliveries quite well which was unbelievable for me. Great work, team. I am gonna suggest your services to more poeple.",2021-01-04T10:18:26.000Z,7,0,Lewis Costin,5.0,2021-05-28 13:37:06.506034,2021-05-28 13:37:08.687667,Coshipper,Trustpilot
33,5fedcf79755dc1032c087234,Happy client..!!!,US,Coshipper did a great shipping service for delivering the goods on time. Their freight charges are quite reasonable. Happy client..!!!,2020-12-31T13:17:45.000Z,6,0,Lauren,5.0,2021-05-28 13:37:08.687667,2021-05-28 13:37:11.902442,Coshipper,Trustpilot
34,5fe6f344755dc107e0cee4f9,Great work.,US,"Using their service for years, and find it useful for smooth flow of shipping from the time good leaves the factory and reaches to Amazon Fulfillment centers here in the US. I've also used them to ship door to door on my EU side. Though with the Brexit its getting to the point where I need to split my UK shipments and my EU shipments. But everything is good. The team really helped my business to grow and literally acts as my """"remote"""" supply chain team. They'll arrange everything from China. I am happy to choose them.",2020-12-26T08:24:36.000Z,3,0,Laura Gonzales,5.0,2021-05-28 13:37:11.902442,2021-05-28 13:37:12.096360,Coshipper,Trustpilot
35,5fe341aa755dc1032c015b9a,Thanks,US,"We no longer spend time identifying the logistics for worldwide shipping. The coshipper team manages our shipments like real pros. Meanwhile, I appreciate the quick custom clearance approach. Thanks!",2020-12-23T13:10:02.000Z,5,0,Lloyd Robinson,5.0,2021-05-28 13:37:12.096360,2021-05-28 13:37:14.310404,Coshipper,Trustpilot
36,5fe07e05755dc10b4829bf3b,High-level customer expectations,US,"Coshipper has proven over and over its ability to respond to our business shipping needs in an efficient and timely matter. They care about the products and shipping like it is their own, and we have a partnership that is essential in the world of continued high-level customer expectations.",2020-12-21T10:50:45.000Z,6,0,Lesa Moran,5.0,2021-05-28 13:37:14.310404,2021-05-28 13:37:18.512571,Coshipper,Trustpilot
37,5fd9f27e755dc10b48249102,Thank you for your great service,US,Thank you for your great service. I have been really impressed with the level of customer service Coshipper provides to us. Reliable and honest business.,2020-12-16T11:41:50.000Z,7,0,Sebrina Potter,5.0,2021-05-28 13:37:18.512571,2021-05-28 13:37:18.706688,Coshipper,Trustpilot
38,5fd7386a755dc107e0c2364d,Can’t rate Coshipper less than 5 stars,US,"Can’t rate Coshipper less than 5 stars. Their team handles all our freight-related work at fair shipping rates. Moreover, I just love the facility of overseas warehouse bcoz this becomes a bliss in case of order rescheduling or unexpected delay.",2020-12-14T10:03:22.000Z,7,0,Leslie R.,5.0,2021-05-28 13:37:18.706688,2021-05-28 13:37:20.908634,Coshipper,Trustpilot
39,5fd35c4c755dc107e0bf662e,Good to see my team,US,Good to see my team can manage all shipping needs & demands. Teaming up with Coshipper has been a fruitful deal for us.,2020-12-11T11:47:24.000Z,8,0,Bruce Malone,5.0,2021-05-28 13:37:20.908634,2021-05-28 13:37:25.124920,Coshipper,Trustpilot
40,5fd0a11e755dc10b481c69ca,Coshipper has been amazing freight partner,US,Coshipper has been amazing freight partner for the growth of our business from start to finish. They walked us through all our shipping options with clarity and 100% transparency.,2020-12-09T10:04:14.000Z,8,0,Alexis McCleary,5.0,2021-05-28 13:37:29.333236,2021-05-28 13:37:29.653035,Coshipper,Trustpilot
41,5fce1bd95e693f09949f401e,Thank you,US,We truly appreciate the support given to me by Coshipper in taking care of our shipping needs for startup business in the USA. Their friendly and personal touch which far exceeds the routine business demeanor very satisfying & refreshing. Thank you.,2020-12-07T12:11:05.000Z,8,0,Elmer Munson,5.0,2021-05-28 13:37:29.653035,2021-05-28 13:37:30.907553,Coshipper,Trustpilot
42,5f945a5c798e6f04a41c81c1,We are an importer and exporter for the…,US,"We are an importer and exporter for the last 8 years. We took a chance on using a 3rd party to work with. This is one of those business decisions you scratch your head and ask yourself why you didn’t make this decision years ago. We are proud to call ourselves a client of Coshipper. Part of our problem was we had so many different business needs to attend to and not enough time to complete daily tasks. Working with Coshipper enabled us to spend our time on the other operational and marketing tasks, and less on sourcing and supply chain. I have 100% faith in this team. I’m quite sure I’ll be learning from them as the shipments keep coming in. This is a first class operation. If you have any doubts then I suggest you make an appointment for a visit at their office in Shanghai and meet these folks. I can now spend more time focusing on product development and marketing needs while they handle our China side consolidation and supply chain.",2020-10-24T16:46:20.000Z,1,0,Sherry Walton,5.0,2021-05-28 13:37:30.907553,2021-05-28 13:37:35.130447,Coshipper,Trustpilot
43,5f5b234f02e8570a1c4828a9,I have been sending goods from…,US,I have been sending goods from Coshipper for a long time. All delivery has been reached to the receiver as scheduled. Thank you for sending the tracking details as well. Great shipping service in town!!!,2020-09-11T07:12:15.000Z,4,0,Alfie Carter,5.0,2021-05-28 13:37:35.130447,2021-05-28 13:37:37.312043,Coshipper,Trustpilot
44,5f58b97902e85707dceef4a2,Coshipper has been a trusted,US,"Coshipper has been a trusted, reliable partner for Bailiwick since the first shipment they picked up. They give me peace of mind knowing that my shipments will get to their destinations on time and in good condition. Using their services allows me to focus on other aspects of the job rather than worrying about logistics issues",2020-09-09T11:16:09.000Z,6,0,Brandon Rees,5.0,2021-05-28 13:37:37.312043,2021-05-28 13:37:37.514501,Coshipper,Trustpilot
45,5f56041402e8570814017b3f,Fabulous shipping service with…,US,Fabulous shipping service with affordable freight charges. Great customer service. Delivers the packages on time. Make sure that there is 0% damage to the goods. Glad to hire them.,2020-09-07T09:57:40.000Z,5,0,Jane Bates,5.0,2021-05-28 13:37:37.514501,2021-05-28 13:37:37.680059,Coshipper,Trustpilot
46,5f50c69802e85708c8dee56c,Coshipper always delivers the package…,US,"Coshipper always delivers the package on time. Their services are highly appreciated. Also, there was no damage done to the products.",2020-09-03T10:34:00.000Z,3,0,Vanessa Grant,5.0,2021-05-28 13:37:37.680059,2021-05-28 13:37:39.929883,Coshipper,Trustpilot
47,5f2ad7e21a5a690a04204f89,Bad experience...Disappointed.,CA,"We tried Coshipper because of these 5-star reviews. We selected the fastest shipping option which was supposed to take around 11 – 18 days and even settled the full cost initially. This was all to make sure that we got the best service that they could offer. Shipping was initiated in late June. Now we’re in the month of August and our goods still haven’t been delivered. This was a very sad experience for us considering this was our first try with Coshipper. We would like this issue to be resolved as soon as possible.

Update: The rest of the goods were delivered on the 19th of August.",2020-08-21T17:59:48.000Z,1,1,Francis Kene,1.0,2021-05-28 13:37:39.929883,2021-05-28 13:37:44.123141,Coshipper,Trustpilot
48,5f1ec1091a5a69071c968e72,I am glad to choose CoShipper since…,US,I am glad to choose CoShipper since their team and business manager has been providing timely feedback and updates on delivery status needs during this tough time with the COVID-19 pandemic and the large delays with amazon's fulfillment centres,2020-07-27T11:56:57.000Z,5,0,Glenn Rodriguez,5.0,2021-05-28 13:37:44.123141,2021-05-28 13:37:44.402904,Coshipper,Trustpilot
49,5f16bb703f06f208b4f0807b,Satisfied customers,US,"We have worked with Coshipper for six months and they continue to impress with their responsiveness, helpful attitude, and reliability. Their shipping rates are even lower as compared to others! We are satisfied customers.",2020-07-21T09:54:56.000Z,1,0,Muriel,5.0,2021-05-28 13:37:44.402904,2021-05-28 13:37:46.612747,Coshipper,Trustpilot
50,5f06e8c43f06f202a4592a2d,Thanks a lot,US,Thanks a lot. It was a really big help for us. You guys have shipped the entire testing kits to our clients without any delay. We are now able to provide coverage to a wide multi-county service area. The transaction was easy too!!,2020-07-09T09:52:04.000Z,2,0,Linda Graham,5.0,2021-05-28 13:37:46.612747,2021-05-28 13:37:48.960339,Coshipper,Trustpilot
