,author_id,title,country,reviews,date,total_reviews_written,upvote,reviewer_name,ratings,start_time,end_time,companyName,scraped_site
51,5efdc6fa3f06f20658d024bb,I am highly impressed with my experience!,US,"This platform provides competitive freight shipping prices and an all-inclusive, easy-to-use shipping experience to its customers. I am highly impressed with my experience!",2020-07-02T11:37:30.000Z,3,0,Carlton Huber,5.0,2021-05-28 13:37:48.960339,2021-05-28 13:37:53.155849,Coshipper,Trustpilot
52,5e915b5a086b6409bc8206be,This was a particularly good experience.,US,"Long time Amazon seller for many years, I can't believe I found such a good freight forwarder in the Amazon service. The various information of Coshipper is very transparent, such as quotation, cargo tracking information, and cargo clearance status. I opened an account on the Coshipper website and I can view all the information about my shipment at any time.This was a particularly good experience.",2020-04-11T05:53:30.000Z,3,0,Clifton Evans,5.0,2021-05-28 13:37:53.155849,2021-05-28 13:37:56.343573,Coshipper,Trustpilot
53,5e8db10c086b6409bc7fde47,Thank you,US,very serious and thank you for this support path. I strongly recommend.,2020-04-08T11:10:04.000Z,4,0,Donna Read,5.0,2021-05-28 13:37:56.343573,2021-05-28 13:38:00.552827,Coshipper,Trustpilot
54,5e78c5153c93ae09180d2c1f,These guys awesome,US,Have used these guys for all my shipment and never have to worry. Will stick with these guys forever!,2020-03-23T14:17:57.000Z,3,0,Mary Davies,5.0,2021-05-28 13:38:00.552827,2021-05-28 13:38:04.726294,Coshipper,Trustpilot
55,5e71d2ab3c93ae0964661ef3,Good work guys!,US,I've been doing Amazon FBA by 3 yers by now and I have worked with a lot of forwarders until i have found Coshipper. They are fast and reliable and they keep you informed all the way until the goods are delivered. Quick replies and best prices make them always my first choice when it comes to shipping. Good work guys! Thank you!,2020-03-18T07:50:03.000Z,8,0,Edward Burley,5.0,2021-05-28 13:38:04.726294,2021-05-28 13:38:07.935419,Coshipper,Trustpilot
56,5e6ca1963c93ae096463d283,Faster delivery service,US,"The Response from the forwarder and my business manager was really sold and consistant. Used their door to door Express Ocean service, 15 days so the delivery was faster than I actually expected, but right on time.",2020-03-14T09:19:18.000Z,3,0,Nicola Graham,5.0,2021-05-28 13:38:07.935419,2021-05-28 13:38:11.162128,Coshipper,Trustpilot
