,author_id,title,reviews,date,total_reviews_written,upvote,reviewer_name,ratings,start_time,end_time,companyName,scraped_site
350,ReviewRow-576,Value your business & never use fedex services,"Value yourself and your business, DHL is a way better delivery company, Fedex should close down
The upsetting experience that I just had with Fedex is embarrasing from a company that is known all over. The drivers are careless, negligents and incompetents, they drop off packages to whatever addresses they feel like just to get empty out their hands. I had a package that dropped off by a Fedex driver at a random USPS location without a known reason, the package is lost without a track and Fedex is not responsable for anything, I have literally called Fedex 20 times without getting to a positive results. I will not ever recommend this incompetent delivery company to anyone. However I got a couple more deliveries from DHL and their service was outstanding. DHL is the responsable company you want to use for your personal or busuness use. I gave Fedex a star because I do not see the minus Zero stars which is what Fedex deserves. Now I have to call the shipper to see what we can do with this hassle. Thanks Fedex for nothing, this company should close business, a two stars reviews is digging you deeper, I hope you get out of business soon.","October 1st, 2020",1,0,Bern P.,1.0,2021-05-30 10:01:55.855141,2021-05-30 10:01:59.081559,FedEx,Sitejabber
351,ReviewRow-710,Unprofessional and not standing behind their customers,"My package was delivered to a well known drug house down the road from my house was in contact with the driver about the address which a typo was made the driver text said he was at my house I replied said no ur not and the response time between our text was like 30 mins due to being busy trying to find water line for my home that every single water line busted during our national disaster from the overwhelming weather we had this past week we have been without water for over 2 weeks now and the package That was left at the wrong address was the main water line that we need to fix the broken pipes so we can get water to our home again after speaking to the driver again today he called the supervisor out of temple and this is where fedex completely 100 unprofessional the lady didn't bother to call me she text me saying that it's not their problem and that I should attempt to retrieve my package from the well known drug house myself and says that fedex isn't gonna compensate my package nor help to get it back from where they just left it at first of all it should have been left on the truck until conformation was made that the driver was at the correct location and tried to re deliver it the next day which would be today but NO my parts needed for my water lines is the hands of known drug dealers and I'm suppose to be out the money I paid for the parts plus the 20 bucks extra to have the next day delivery which is 4 days late already you would think that as big and as much as everyone uses fedex that the company would try to accommodate their loyal customers a little more than what they do which is absolutely NOTHING I VERY DISAPPOINTED IN THEIR ACTIONS AND IM NOT DONE HERE I WILL BE CONTACTING THE LOCAL NEWS MEDIA TO PUT FEDEX IN THE spot light so everyone can be aware of how dishonest and unprofessional fedex is... I gave them every opportunity to do right and to make things right for the mistake they made by leaving my package at the wrong house and the refuse to do so. They leave me no other choice but to make their mistakes known to the world. God bless yall at fedex God don't like ugly and that yall have been
Service:1
Value:1
Shipping:1
Returns:1","February 26th, 2021",1,0,Patricia B.,1.0,2021-05-30 10:01:59.081559,2021-05-30 10:02:03.429371,FedEx,Sitejabber
352,ReviewRow-242,Yet another 1-Star review,"On Wed Jan 22 I was sent a tracker by FEDEX informing me that my package would arrive Friday by 8PM. This fit into the 2 day shipping which I had paid for so I was OK. Friday Jan 24NO PACKAGE. I checked the tracker and the delivery dated was moved back to Monday by 8PM. This I was not OK with, especially since their tracker indicated that my package was 45 min from my house. I offered to pick it up myself, to which I was informed that they would not relinquish the package while ""in transit"". Maybe it was just a bad employee. I tried another two times once nicely the second with the promise of a bad review. No cooperation. FEDEX politics dictate that employees have no common sense. I will give them credit though; they were very polite as they informed me they are useless. I pray my package arrives on Monday.","January 25th, 2020",1,1,Gustavo T.,1.0,2021-05-30 10:02:03.429371,2021-05-30 10:02:05.632284,FedEx,Sitejabber
353,ReviewRow-233,Never had a good experience,"I have never once had a good experience with fedex! Recently I missed a delivery and requested a re delivery attempt the next day through a FedEx employee over the phone. What that employee failed to tell me was that it wasn't guaranteed that it would actually be re attempted. So I sat around waiting at home the next day waiting for the package to sent to me but nothing came. And only when I called and asked for the whereabouts of my package did they tell me it's not a guarantee that my package would be sent out again. Now I have wasted an entire day in which I had originally planned to be productive. I truly wish companies would stop using fedex as a delivery service and just stick to Canada post. If you ever have an option, NEVER CHOOSE FEDEX!","December 20th, 2019",1,0,Linh B.,1.0,2021-05-30 10:02:05.632284,2021-05-30 10:02:07.872427,FedEx,Sitejabber
354,ReviewRow-627,Waste of money and time. Unreliable service!,"Can I give a negative one million star please? I've been shipping package from Canada to the US every week and never encountered a problem. However, buying stuffs from the US and paying for international priority shipment is TOTALLY not worth it. This is the second time that I lost my package. The address is very clear and if the driver couldn't find it he/she could have called me cos my phone number is in the waybill. I let it go the first time but not this time. I think making the same mistake is just STUPID! They don't even care whether the package gets delivered to you or not. I don't know what kind of people they hire to work for FedEx. In fairness, some customer service representatives are nice but some are complete $#*!s. I don't want to mock anyone but majority of their drivers are COMPLETELY DUMB! How can you make the same mistake twice and deliver a package to the wrong address? Then when you follow up with them they'll tell you that it might be stolen. It might not be stolen - it might be that the driver is so dumb to figure out that he/she is delivering to the wrong address. Can they not read?! Very stupid!","December 8th, 2020",1,0,J R.,1.0,2021-05-30 10:02:07.872427,2021-05-30 10:02:10.080222,FedEx,Sitejabber
355,ReviewRow-727,Bad,"I had a package come for a overnight shipping and never got my packege they ain even try n deliver it they jus sent it bck to my mom again and then she reshipped it it was suppose to be here yeaterday and never came were my package at dawg
Service:1
Value:1
Shipping:1
Returns:5","March 14th, 2021",1,1,harmony m.,1.0,2021-05-30 10:02:10.080222,2021-05-30 10:02:12.451536,FedEx,Sitejabber
356,ReviewRow-280,Never received package ordered on April 11th 2020,"Package has clearly been lost or stolen by employees since last update on tracking system on May 5th said handing off to USPS. USPS has not seen it and it is not in their system per a local manager who checked for me. I have not been able to reach a live FEDEX person since all contact numbers are routed to an autonated voice service or computer. It keeps telling me to check the tracking info which I did and which only provides the above false data. Then the computer hangs up on me. Great service! They clearly don't want to know that employees are stealing packages and don't want to help out! Never ever order from a retailer who uses this company and do not buy service from FEDEX. If you want to be cheated and stoken from, go rght ahead! I never could believe that a company doing this would stay in business. They should be convicted of mail fraud since they are stealing packages and the customer has no way of finding the package, because they refuse to help out! This is horrid! I used to think FEDEX was a good company. It is NOT! Use UPS instead or USPS.","May 11th, 2020",1,0,Nancy B.,1.0,2021-05-30 10:02:12.451536,2021-05-30 10:02:15.708776,FedEx,Sitejabber
357,ReviewRow-264,Horrible service!,I wouldn't even give them one star! By far the worst deliveey service i've ever seen in my life! I ordered a birthday present for my daughter from walmart and UNFORTUNATELY it was sent via fed ex! What was supposed to be a two day delivery has been a week and two days! They first day they left a soor tag... okay. Was a little upset since the driver never rang doorbell or knocked! I signed the doortag and put it back on door so they could leave pkg. All of a sudden they are saying my pkg was delivered. I had to call the supervisor and have them trace my pkg. It took two days fot them to make a 2nd attempt. On the 2nd attempt the driver goes to my other door bypassing the door he used the first day with signed tag on it and left ANOTHeR door tag! I called them again they assured they woukd have driver come back out that night and redeliver! Never saw him at all! Now they are telling me my pkg is being held at an office in seekonk because they made 3 attempt... which is BS! But yet they tell me they cannot tell me what facility it is held at! I am so done with fed ex! Nothing but a bunch of useless morons that work there! Will NEVER do business with anyone that even uses fed ex! They all suck! $800 package stuck in limbo screw that!,"April 23rd, 2020",1,0,Tina A.,1.0,2021-05-30 10:02:15.708776,2021-05-30 10:02:19.920358,FedEx,Sitejabber
358,ReviewRow-220,The worst experience,"Never use FedEx! I was sitting at home for two days in a row waiting for my package but only got messages that they were unable to deliver the package because nobody was home. I didn't leave home for a minute during two days and definitely was home at the time they mentioned in the tracking history when they ""made delivery attempt""","November 20th, 2019",1,4,Maxim N.,2.0,2021-05-30 10:02:19.920358,2021-05-30 10:02:24.181952,FedEx,Sitejabber
359,ReviewRow-543,FedEx all over the place,"Ordered a package that was sent from Troutman, Oregon. It made it to Beaver Crossing, Nebraska in one day and arrived in South Pittsburg, Tennessee the next day. It sat there 4 days before being shipped to Atlanta, GA (4 hours max away). From Atlanta it was shipped to Charlotte, NC (passing within one hour of our house). From Charlotte it was shipped past us to Augusta, GA (again coming within 1 hour of our house) where it sat for 3 days before heading past our house (within 40 minutes) to Spartanburg, SC. Next it arrives in Greenville, SC for a day before being delivered to Greenwood, SC. REALLY? At 4 of the points, I could have driven under an hour in any of 3 directions and retrieved the package.","August 28th, 2020",1,0,Lewis W.,1.0,2021-05-30 10:02:24.181952,2021-05-30 10:02:28.426227,FedEx,Sitejabber
360,ReviewRow-230,Fed Ex Sucks!,"The worst ever!
I wish I had a choice on who delivered my packages. If you have a choice dont use Fed Ex","December 12th, 2019",1,1,Tony J.,1.0,2021-05-30 10:02:28.426227,2021-05-30 10:02:32.630427,FedEx,Sitejabber
361,ReviewRow-202,The Tracking Bully,"Takes your money and makes you pay for asking about the tracking number! As if it is such a hard worn secret! Comes only around noon when everyone has gone back to work so as to pull their pranks without any other neighbor on the street! Likes most especially to boss you on how to hold their machine upright for the signature and best of all, control how you should be holding the pen!","August 29th, 2019",8,17,False,1.0,2021-05-30 10:02:32.630427,2021-05-30 10:02:34.840670,FedEx,Sitejabber
362,ReviewRow-226,Nothing but lies,Short simple I've called him several times To confirm where my Package is have been informed will be there by end of day still haven't gotten it Still city an hour away from my house 3 days later. I've called in several times been given several different answers then told I would get a call back twice No call finally got through to a dispatch worker she contacted the Contractor that is in control of my package they informed her it is on the truck but it is not moving today no one can do anything. On 2 of the call's that I made I was dropped back into the queue once directly back to another representative the other time just back into the prompts It's pretty Badd when the government Can run a shipping organization better then a Private company.,"December 8th, 2019",1,0,bryan h.,1.0,2021-05-30 10:02:34.840670,2021-05-30 10:02:38.050950,FedEx,Sitejabber
363,ReviewRow-281,A sorry company,They are the worst and all you get is I'm sorry SORRY IN INCONVENIENT FOR ME I WILL NEVER GET ANYTHING THRUTHIS COMPANY AGAIN,"May 12th, 2020",1,0,Tee R.,1.0,2021-05-30 10:02:38.050950,2021-05-30 10:02:42.304079,FedEx,Sitejabber
364,ReviewRow-657,Garbage,"Waited for a week/10 days, because of Covid and stuff, i knew delays may happen... No worries, but they told me Dec 28th my package will be delivered, then 10:12 am on Dec 28th, told me no one was home, so they drove off... i called support 10 mins later on and they told me ohh he came no one was home, then i asked then where is the slip? OHH BLA BLA... FEDEX IS GARBAGEEEEEEEEEEE, LIERSSSSSS i wish i could curse you... i would curs so muchh. FFFFF... UuUUUUUUUUUUU
Service:1
Value:1
Shipping:1
Returns:1","December 28th, 2020",1,0,taner b.,1.0,2021-05-30 10:02:42.304079,2021-05-30 10:02:45.701917,FedEx,Sitejabber
365,ReviewRow-328,Boooo on fedex,"Fedex employees lied to me. My son lost out on his bed and I lost out on my money.
They left it in their warehouse in another town for days, then I called and they put a trace on my package and their trace showed that it was delivered to my home days before when it never was.
I called again and they told me to take it up with the seller on ebay but it wasn't the sellers fault. It was FedEx.
So I hope the employee is enjoying my son's bed frame. Hopefully it went to another child and not some creepy dude driver that's using it or something. I hope the guy who took it is 6""3' and has no chance being comfortable in my 9 year old son's bed.
I mean, they steal people's items, customer service is not very good.
Their shirts say they care, they don't care. They only want the money and they open people's packages and all the drivers are super rude. Idk why. Maybe they're all miserable in that joke of a shipping company?
Idk why this service is so horrible. They don't give you respect and they lose items and they lie and they get away with it.
I wonder if the head honchos of this company know about how terrible their employees are. They should have them be on camera at their jobs to stop. Employees from stealing and really come down hard on their people working in the customer service and listen to the customers because we tell how it is and how it goes.
I mean most people hate fedex... It's no wonder.
Who is the CEO of this company? Is he sleeping? On vacation? Sitting back with a cigar and an iced tea? Maybe he's in a coma and that is why this company went to sh**?
If I wrote the higher ups do you think they'd care? I thought it was just me having a bad day and some bad luck but no as I go online there are all these people giving terrible experiences and one star ratings. I mean as I read other people's reviews. I just shake my head because I'm in shock. How can a company be this terrible and get away with it? Hire more boomers! Hire the older people. This world isn't what it used to be. No respect. Nobody follows rules. I wish I could be the fly on the wall in their warehouses.
Karma works. I put it out there. Karma watches and waits and isn't prejudiced. One day I'm sure we'll all read about how fedex went under because of how terrible of a company they really are.
Where are all the good workers at? Do they exist anymore? Do they just enjoy hiring punks?
Stop using this company. Use UPS instead. Or just USPS.
YUCK ON FEDEX. BOOOOO!","July 20th, 2020",1,1,Judy-May C.,1.0,2021-05-30 10:02:45.701917,2021-05-30 10:02:47.928719,FedEx,Sitejabber
366,ReviewRow-227,FedEx clearly doesn't care.,"FedEx is clearly, trying to get sued. The last time I used FedEx was before Christmas of 2018 when I ordered a gift for my mother from Target. My package was suppose to be delivered 2 days after the order date but when I finally got it, it was almost 2 weeks later. After that, I was done with FedEx. Now, almost a year later, I am waiting for a 1lb package from FedEx. Considering it was shipped from Social Security (so I had no choice in the shipping option) not only has it been 3 days since I was SUPPOSE to receive this package but now FedEx is using the SAME excuse they used the last time I dealt with them. ""Incorrect address."" Oh, you mean the same address that your superior clearly saw on the same Google Maps app that you use, that you claimed doesn't exist? You mean the same address that a delivery man from Bath & Body Works found and delivered my package at 8am? You mean the same address that Social Security has sent paperwork to during the months of September and October (through regular post mail might I add) that I've received? That address? I'm convinced all FedEx locations in Maryland are incompetent at best.","December 9th, 2019",2,5,Vivian J.,1.0,2021-05-30 10:02:47.928719,2021-05-30 10:02:50.190361,FedEx,Sitejabber
367,ReviewRow-216,Horrible delivery service,"Delivered my furniture to the wrong house thank goodness the people they delivered our furniture were honest people and they drove to our home to tell us that fedex delivered our furniture to there house! Not only did we have to get a truck to move the furniture to our home but have someone lift it for us! Then they delivered a rug to the wrong house I don't know if they do not know how to read or what the issue is but I will never ever use fedex for anything they are horrible!
Service:1
Value:1
Shipping:1
Returns:1","October 26th, 2019",1,0,Cindy s.,1.0,2021-05-30 10:02:50.190361,2021-05-30 10:02:54.645491,FedEx,Sitejabber
368,ReviewRow-192,Less than one star service,Every time we get shipped fedex its horrible! My delivery person wants to keep the same packages on the truck for over a week. Every day tracking says out for delivery. But at the end of the day. They go back to fedex and start the same thing over four days in a row. Called fedex took over an hour to get to a person. Said package delivered next day. Never got it. From now oo will not purchase from business who use fedex YES ITS THAT BAD!,"July 20th, 2019",1,0,Michael O.,1.0,2021-05-30 10:02:54.645491,2021-05-30 10:02:56.867410,FedEx,Sitejabber
369,ReviewRow-222,Missing pqckages,"In the last 3 months, I have had packages from swap.com marked as delivered but they were not because I used Walgreens pharmacy as pick up. I complained about the driver stealing packages but FedEx did nothing about it.","November 25th, 2019",2,20,Cosmos l.,1.0,2021-05-30 10:02:56.867410,2021-05-30 10:02:59.285868,FedEx,Sitejabber
370,ReviewRow-703,FEDEX KEEPS LEAVING MY PACKAGES AT THE NEIGHBOR HOUSE NEXT DOOR,"THEY KEEP LEAVING MY PACKAGES AT THE HOUSE NEXT DOOR BY MISTAKE. I KEEP CALLING THEM EVERYTIME THEY DO IT AND NOTHING IS DONE.

IT HAS HAPPENED FOUR TIMES NOW. THE FIRST TIME IT HAPPENED WAS TWO YEARS AGO. MY DAUGHTER HAD TO SEND BACK HER NEW COMPUTER TO LENOVO FOR A SMALL ISSUE. FEDEX DELIVERED TO THE HOUSE NEXT DOOR. I IMMEDIATELY CALLED THEM AND WAS INFORMED THAT THE DRIVER WOULD RETURN ""THE NEXT DAY"" TO RETRIEVE THE COMPUTER. THEY CAME THE NEXT DAY AND WAS UNSUCCESSFUL. THEY KEPT TELLING ME THAT I SHOULD GO AND RETRIEVE THE COMPUTER THAT THEY HAD DELIVERED WRONGFULLY, BUT I KEPT TELLING THEM THAT THIS WASNT MY PROBLEM AND I DIDN'T WANT TO MAKE IT ONE FOR ME. IF I GET BEATEN UP, WHO PROBLEM WOULD IT BE?

THEY ALSO TOLD ME AT THE DELIVERY OFFICE THAT IF THEY DONT RETRIEVE THE COMPUTER THAT THEY WOULD GET LAW INFORCEMENT INVOLVED. BUT AFTER THE THIRD ATTEMPT THEY MADE TO RETRIEVE THE COMPUTER, I FOUND OUT THAT IT WAS ALL LIES.

THEY TOLD ME TO START A CLAIM, FEDEX ONLY INSURES UP TO $100.00 DOLLARS. LAW INFORCEMENT OFFICIALS WERE NEVER CONTACTED.

THE 2ND. TIME THE CHILD BRUNG ME THE FOOD THAT I HAD ORDERED. THE PACKAGE WAS INSIDE THEIR FENCE AND HE SAW ME AND BROUGHT IT TO ME.

THE 3RD. TIME I CAUGHT THE DRIVER AND HE BOUGHT IT TO ME.

THE FOURTH TIME WAS LAST FRIDAY, THEY DELIVERED THE FOOD AGAIN NEXT DOOR. MY NUMBER WAS ON IT AND THEY LEFT A MESSAGE THAT THEY HAD A PACKAGE OVER THERE. I ONLY GOT THE MESSAGE AFTER I PICKED UP A PACKAGE OUTSIDE AND REALIZED THAT IT WAS THE PACKAGE IN QUESTION.

I CALLED FEDEX AGAIN AND TOLD THEM IT APPEARS TO BE A GPS ERROR, BUT THE PERSON THAT I SPOKE TO IN THAT DEPT. WAS VERY UNSYMPATHETIC AND VERY RUDE. I TOLD HIM ABOUT THE FOUR INCIDENTS AND HE BASICALLY SAID HE DIDNT CARE THAT I WAS WASTING HIS TIME. HE STAYED THAT I TOLD HIM THE SAME STORY 'FOUR"" TIMES.

I'M NOW COMPLETELY FED UP WITH FED EX.
Service:1
Value:1
Shipping:1
Quality:1","February 23rd, 2021",1,0,elizabeth h.,1.0,2021-05-30 10:02:59.285868,2021-05-30 10:03:02.845705,FedEx,Sitejabber
371,ReviewRow-168,Packages always delayed!,I have a business and several times my tracking says on Fed ex vehicle for delivery only to wait all day to have them not deliver and have it change to the next day to only have it happen again! I'm losing money because I can't get my shipments on time! Customer service sucks- they only say well they have until 8pm to deliver - but never happens- My service area comes out of the Franklin PA station. Horrible horrible service,"March 9th, 2019",1,3,Kristy M.,1.0,2021-05-30 10:03:02.845705,2021-05-30 10:03:05.070632,FedEx,Sitejabber
372,ReviewRow-675,Lost Car Title $36k- Thinking FedEx? DONT,"My particularly important package (my brother's Car title valued@ $36,000 minimum) has been sent on January 17th, 2021 from location 2413 Flatbush Ave, Brooklyn NY 11234. The FedEx Tracking # is 7827-0072-6887.

I spoke with customer service and international FedEx department at 5:35pm on 1/23/2021 and she stated on the line that have no tracking of the package and someone will call me.

Then we went to the FedEx location at 2413 Flatbush 5:45 pm, they said they are not sure what is going on. So, they put us on the line with number *******747. They said the package is with US Customs and might receive the package on Tuesday.

After 15 min later at 6:11pm FedEx called me and said the package is lost and emailed me the form to fill out and file complaint. Phone call received at 6:11 pm spoke about 26 min. This is the number +1 *******339 ""package could be lost or shedder"". She had also mentioned thin mail like checks and one page mailing sometimes get shredded in the conveyor belt if not in the appropriate conveyor belt. I have stated this was a car title, particularly important paperwork, and have paid accordingly.
The customer service rep also mentioned that FedEx employees routinely lie about the status of packages, sometimes knowingly knowing the package is lost and telling customers that they are not lost and are on track to be delivered.
My brother, who works for the US Government, a Patriot, working to keep terrorists at bay and protect American citizens, was not able to get a simple, business as usual package to be delivered by FedEx, a car title that he needed to register with the government of Canada on behalf of the USA.

Tracking # *******26887

I want my full refund, in addition to the fees for getting my brothers new title, and expedited fee, and pain and suffering and wasted time and effort of myself, my brother, my sister and her husband. Our average salaries are $100k each and we demand retribution. I will be reaching out to ALL blogs especially with UPS, USPS, and DHL to express my horrible experience with FedEx.
Service:1
Value:1
Shipping:1
Returns:1","January 23rd, 2021",1,0,Mahbubur R.,1.0,2021-05-30 10:03:05.070632,2021-05-30 10:03:07.457556,FedEx,Sitejabber
