,author_id,title,reviews,date,total_reviews_written,upvote,reviewer_name,ratings,start_time,end_time,companyName,scraped_site
492,ReviewRow-194,FRAUD! I have a business account with them(well atleast what I am not going to be using anymore),"If you have an account with Fedex and UPS. Choose UPS! Despite the bad customer service. Back in JAN switched to Fedex a Sales rep Ivan Mascarell gave me good/attractive discounts and assured me that I will not fee any fees that I saw with UPS on my account; so I switched to Fedex(Moonachie hub/main is right behind my store; easy for the drop-off + good rates... what was there to loose?) happy I get to save more; meaning I make more money.

So it's 7/30/2019 and yesterday the 29th I was going through the invoices paid with the receipts. Guess what; 40-60% upcharge. A 10$ shipment turned into $30 all of a sudden. Handling charges added anywhere from $9-97 as I have seen. Surcharges and residential charges added on onto the invoices(god damn you are a shipping company; add that on when you are giving me rates before shipping instead of making excuses that that was a quote that was given; which is the excuse you gave me) I am getting a little aggravated and would like to rip them a new one but. I WOULD RECOMMEND IF YOU ARE RUNNING A BUSINESS, AND YOU WOULD NOT LIKE TO GET ROBBED! STAY AWAY FROM FEDEX!
Service:1
Value:1
Shipping:1
Returns:1","July 30th, 2019",1,0,Taimur A.,1.0,2021-05-30 10:10:10.049469,2021-05-30 10:10:13.398589,FedEx,Sitejabber
493,ReviewRow-125,"THEFT, LIES, INCOMPETENCE, HAVOC","FedEx employees or affiliates in contact with my packages SLIT OPEN the tape on my boxes AND STOLE my property during shipment across the US.

I spent A LOT of money shipping several boxes. Not only did the staff continually screw up my online, over the phone and in person pick up with my order pretty much EVERY TIME, but they also STOLE from me and refused to acknowledge this crime even happened. All they could do was say: ""sorry your boxes got lost.""

My boxes were CUT OPEN, STOLEN FROM, taped back up and delivered from My personal location A to my second personal location B EMPTY or nearly EMPTY. How does a delivery person drop off a box that is CLEARLY labeled ""30 LBS"" and ""28LBS"" and the weight is practically nothing at delivery?

My CANCER MEDICATION and other valuable personal items were stolen.

I am continually appalled by this company and this THEFT was the LAST STRAW.

I WILL NEVER USE FEDEX AGAIN.

This was only the most recent thing that happened to me, after giving this absurd company multiple chances to redeem the quality of their service.

Last summer, they lost... LOST a 100LB Air Conditioner that was Expedited shipping for medical purposes.

Also, last fall, they delivered an exercise bike I ordered online TO ANOTHER ADDRESS, when it was CLEARLY marked with my address and needed a signature upon delivery. They left it in an empty office with no one around.

MULTIPLE TIMES, Fedex would send me text or email claiming my packages were delivered, but they were NOWHERE TO BE FOUND. OR --- they would claim ""Undeliverable"" because no one was home or ""business closed"" when they were delivering TO MY HOME and when I was sitting by the door waiting for certain products.

FEDEX has let me down way too many times.","June 20th, 2018",1,2,JER E.,1.0,2021-05-30 10:10:13.398589,2021-05-30 10:10:16.641002,FedEx,Sitejabber
494,ReviewRow-107,Worst Courier,"FedEx is the worst courier company I 've ever used. I recently used their service twice to send items overseas. Their customer service was positive that the shipping time will be the one they advertised in several questions.
But they did not keep any of their promises. They actually caused damage to the items sent, and they were finally delivered in 7 working days instead of 2 that they had promised. Contacting their customer support when the delay was obvious they were saying that something happened and that the package would be delivered soon enough. After several calls it was obvious they were lying as they used different excuses and it was clear that people nearby were laughing hearing the excuses.","December 15th, 2017",4,8,Sophi S.,1.0,2021-05-30 10:10:16.641002,2021-05-30 10:10:19.889237,FedEx,Sitejabber
495,ReviewRow-70,PACKAGE AN HOUR AWAY,I ordered from NFL SHOP AND IT WAS A DELAY IN MEMPHIS FROM FEDEX I PAID FOR ONE BUSINESS DAY SHIPPING ON THURSDAY 1/12/17 AND MY PACKAGE HAS BEEN AN HOUR AWAY FROM ME SINCE 6:22 AM AND NOW IT'S 8:01 PM WHY IS MY $#*! IN RALEIGH NC AND NOT HERE IF FEDEX RUN ON SATURDAY THEY SAY IT'S NOT GOING TO B HERE UNTIL MONDAY NOMORE FEDEX STRAIGHT UPS FOR NOW ON,"January 14th, 2017",2,1,Shaquille W.,1.0,2021-05-30 10:10:19.889237,2021-05-30 10:10:23.119566,FedEx,Sitejabber
496,ReviewRow-195,Can I give minus stars? How about a minus 5 star?,"I have to say that this was the ABSOLUTE WORST shipping experience with Fedex that I have EVER HAD. EVER. And I don't want to ever have to repeat it either.

I ordered a lift kit from AutoAnything and they paid Fedex 2day shipping to get it to me. Guess what Fedex did? Made it last 7 days.

I'm currently in Fairbanks, AK. The part was being shipped out of Lansing, MI. It left the facility okay, Made it from Lexington, KY to Anchorage, AK okay. And that's where everything stopped. Fedex kept it in Anchorage for THREE DAYS. No word, no explanation. No delivery date. Nothing.

I had to contact Fedex live chat in order to find out what was going on. All in all, I had to talk to Fedex at least 3 times. They had to open 2 cases regarding this package. The funny thing is, the minute I contacted them the first time, Fedex contacted me back and explained that the package was being held for border issues. Why? It didn't cross any borders. It was flown into Anchorage from the states.

As soon, as Fedex called me, the package was mysteriously back en route again. And amazingly, it only took 2 hours to get from Anchorage to Fairbanks. How did they do it?

Then it stalled for 2 more days in Fairbanks. I had to chat with Fedex again twice. I asked them if they were planning on keeping the package indefinitely or were they going to eventually release it? The customer service rep opened another case, promised that Fedex would contact me (which they never did) and as soon as the third chat ended, the package was mysteriously scanned onto a truck for delivery within 15 minutes. How does this happen?

Needless to say, a Fedex 2day delivery turned into a Fedex 7day delivery and would not have delivered then if I hadn't BEGGED them to release my package.

And quite honestly, I was expecting my package to be destroyed when it finally delivered. I figured Fedex would have used it as a basketball or football. I was surprised to see it intact actually. Very surprised. Mystified almost.

Upon receipt of the package, I did contact AutoAnything back and suggested to them that they get their shipping charges reimbursed since the order to deliver wasn't honored. They thanked me for the information.

Keep up the good work Fedex, you're making the US Postal Service look REAL GOOD!","August 3rd, 2019",2,4,Andy C.,1.0,2021-05-30 10:10:23.119566,2021-05-30 10:10:27.340699,FedEx,Sitejabber
497,ReviewRow-132,Terrible company to use,"Total lack of customer service, constant misdeliveries or lost deliveries and a system that is so inept it should be shut down. There is absolutely nothing good to say about this so-called delivery service. I always ask everything I buy online NOT to use this company but the usual reply is to pay for a signature service (which again is useless) or this is the only shipper they use. With all the terrible reviews this company garners it's amazing it is still in business.

I am not a complainer and have 100's of reviews at Amazon and eBay with over 98% all positive but I just cannot take the poor service FedEx believes it can get away with. I have used them for over 10 years or more and back in the day they were actually a great company but the last 3 plus years they have sunken to the bottom of the barrel. I had to stop purchasing from a couple of companies I love because they will only use FedEx and I am sure it is because of the low rates they must offer. (PLEASE CHEWY.COM change your delivery service, I miss purchasing from you.)

I believe in paying more for better service and also believe you get what you pay for. So FedEx must have gotten so bad they offer extremely low rates for companies to use them as their exclusive delivery service. But this will catch up to them and the companies that continue to offer this as their only shipping option.

I would have never thought to say this but the service at our governments' postal service has been outstanding. UPS has also been easy to use as well but in my opinion not as good as USPS.

I would be embarrassed to say I work for FedEx. The whole system needs to be overhauled including getting rid of the current management who feel treating the customers as inconveniences rather than their lifeblood.","July 15th, 2018",2,3,Glenn G.,1.0,2021-05-30 10:10:27.340699,2021-05-30 10:10:30.537274,FedEx,Sitejabber
498,ReviewRow-57,"Fed-ex Ground Shipping, Beware","I ordered an item and it was shipped by Fed-ex ground to Martinsville, Indiana. I did not receive it and called the vendor. Fed ex tracking said it was delivered. My neighbor said he watched the driver put it in my U.S. Postal mailbox (Which I thought was totally illegal). Whether the mail carrier removed it or someone stole it, I dont know. I filed a claim and although their site says you don't need supporting documents for claims under a $100, they insisted the vendor provide them. After 2 months of run around, they sent me a letter denying my $27 claim. Well, I will never order anything again that uses them for the shipping agent. I actually got the last laugh! Although this was the first time I dealt with them on a personal level, my employer used to spend a healthy chunk of change with them. Not anymore.","April 18th, 2016",3,25,cherril b.,1.0,2021-05-30 10:10:30.537274,2021-05-30 10:10:34.788055,FedEx,Sitejabber
499,ReviewRow-98,Not satisfied,I order online for 95% my shopping as I have cancer and cant lift much. I have a shunt in my brain and Im not supposed to lift over 5 pounds but my local FedEx man decides he will not carry my packages to my door no matter the white or sat there for at least me doing it and then was in the lap in the hospital over at my daughters staff was dropped and cracked needless to say I havent had a chance to open the rest to make sure it wasnt messed up have a very lazy FedEx man very upset and aggravated mad with FedEx FedEx is a sorry excuse for a human being place if you cant lift over 5 pounds you order dont have that shipped FedEx if you have a local FedEx guy like you have please for your health dont do it I live in West Virginia Im not trying to badmouth our FedEx gas there are some great guys out there and ladies but one I have I dont suggest ordering if you live in McDowell County of West Virginia because you would do his job because he just wants to stand there and look last Im sorry for being like this but I am so mad and aggravated and her cancer is no joke you hurt you stay in pain you live in pain I want to 33 radiation and 148 Kemos six brain surgeries go through the California three then you see how it feels to have to do somebody elses job what if the tumor in my brain bust? So please FedEx did your gas your ladies to do their job carry the package to the door I dont expect it to be carried in my home can you to do I have a re-activate the ranch right now is mature it be easier oatmeal and meet you please give your workers to do their part thank you for all the good help you have supplied have a wonderful holidays,"November 1st, 2017",6,3,Amanda M.,1.0,2021-05-30 10:10:34.788055,2021-05-30 10:10:38.019294,FedEx,Sitejabber
500,ReviewRow-209,They don't know the answer!,"I contacted them on FB and asked them to tell me what they charge per copy for using their copiers, i. E., to photocopy a few sheets of paper in standard 8.5"" x 11"" black-and-white format. This was their response:

Hi Meg, the FedEx Office team hours are Monday-Friday, 7:00 AM-8:00 PM CT, and Saturday, 7:00 AM-6:00 PM CT. The team will respond upon its return. ~~Rebecca
8:24 AM

HI, Because this is a custom print job, we ask that you contact your local store for more information.

To find the closest FedEx Office location to you, please visit our website at http://www.fedex.com/us/office/ to access our homepage. You can then hover over ""Location"" on the top-right of the page and enter your zip code.

You can also find your nearest location by calling our 24-hour Hotline at 1.800. GoFedEX *******339 press 64 or say FedEx Office Services.

Sincerely,

Buzz
FedEx Office Customer Relations
FedEx Office Printing Services
Get professional, high-quality copies from FedEx Office. Full service or self service, at any of over 1,800 locations.
fedex.com

Hello Meg,
In order for us to better serve you, please take a moment to tell us about your recent social interaction with FedEx.
https://ftc.secure.force.com/liveagent/apex/takesurvey
ftc.secure.force.com
ftc.secure.force.com

After I scrolled down for a full minute, I wrote back and said, ""So you can't give a simple answer to how much a copy costs?
Rather than writing a book, a proper response might be I don't know twelve cents."" And then several hours later, after they saw my response but didn't reply, I wrote, ""I'm still waiting for an answer,"" because at this point, why not have fun with these imbeciles?","September 28th, 2019",2,65,Meg K.,1.0,2021-05-30 10:10:41.154904,2021-05-30 10:10:44.402667,FedEx,Sitejabber
501,ReviewRow-64,FedEx. Why did you become so incompetent?,"FedEx used to be the gold standard of shipping, but somewhere along the line they have turned into a completely inept operation.

I set up a vacation hold on my account using the delivery manager on their site. Two days after the vacation hold date started, they delivered a package. (We could see the package on our step via the security camera.) When contacted they said they had not made any deliveries to my address in 6 days. I had an email that arrived prior to my calling them that advised the delivery was made the day before I called. The agent also denied seeing any vacation hold placed on my account or for my address, although when I went on line, the hold was still in place. They also have been delivering packages with damage even worse than UPS (and that says a lot!) I started using Amazon prime because I read that they have their contract shippers dedicated to Amazon and what a difference. Timely, no damage. So it is clear it can be done. FedEx needs to figure out how Amazon's shipper does it.","August 6th, 2016",1,10,BC P.,1.0,2021-05-30 10:10:44.402667,2021-05-30 10:10:47.623332,FedEx,Sitejabber
502,ReviewRow-92,Fedex Smartpost is transported by camels,"Fedex SMARTPOST is a waste of time and money and does not belong in a society in which things are available to the consumer cheaply and efficiently. Having Fedex in the name is completely misleading to the american public and someone should bring a class action lawsuit up against them because of them spending years building up the name Fedex a being a fast delivery and bait and switching you into this crap.
Here's my story: my package shipped on 08/22/2017@ 8:47 pm from Henderson CO, via Fedex SMARTPOST. Fedex says it will take until 09/02/2017 to get to it's destination in GA, 1578 miles away (that is 12 days). Which means that my package is traveling at 5.23 miles per hour. How could it possibly be that slow. Is it on a camel? Is there someone walking it to me? I don't understand what the problem is. I was never informed that my Fedex Smartpost delivery was actual this slow prior to my order I feel completely tricked into this shipping option that I never would have chosen.

In the future I will now go completely out of my way to insure that any item that I have shipped to me IS NEVER SENT BY Fedex or Fedex SMARTPOST, I will warn all of my friends and family and I will post on every social media outlet that I can find how crappy this service is. If it is the only option I will have to do without, it does not deserve to be paid for.

And your customer service agents are obnoxious robots.","August 25th, 2017",2,4,Carolynn f.,1.0,2021-05-30 10:10:47.623332,2021-05-30 10:10:51.882231,FedEx,Sitejabber
503,ReviewRow-465,Contacting Bongo,"For clients overseas it is very difficult to contact Bongo via email. There is a phone number, however when the time difference is 12 -15 hours one would have to stay up late in the night to sort out a problem which need immediate attention.","February 1st, 2016",1,3,Mike M.,4.0,2021-05-30 10:10:51.882231,2021-05-30 10:10:54.115200,FedEx,Sitejabber
504,ReviewRow-74,Delivery service staff doesn't work properly,"My wife and I were expecting a very urgent and important package. Despite the fact that we stayed home all day waiting for the fedex delivery guy, the package never arrived. Later that day we saw ""sorry we missed you"" paper in the mailbox. We called fedex and asked to redeliver the next day. The same thing happened the next day, except that in addition to that the delivery guy even rang our apt. Number to buzz him in. We buzzed him in and were waiting for him to come up and once again he never showed up. Next thing we know, we see another ""sorry we missed you"" paper in our mailbox. The guy was too lazy to come up to the 2nd floor. This was extremely annoying and inefficient. Eventually we had to go to the fedex office in person to pick it up.
Our location: Bay Ridge, Brooklyn, USA","March 3rd, 2017",2,12,Alexander L.,1.0,2021-05-30 10:10:54.115200,2021-05-30 10:10:57.350553,FedEx,Sitejabber
505,ReviewRow-110,Beware of FedEx shipping,"FedEx is the worst shipping company to use. Packages do not arrive on time, the tracking is not up to date, and customer service is horrible. I ordered a package on December 7th that had an arrival date of December 14th and as of December 20th, they do not know where it is. I was told they will contact me within 72 hours and if I do not have my package by December 26th, after Christmas and 12 days late, I should call them. I attempted to contact corporate and was unable to get an email address or phone number. This company may be long standing but is currently a joke. My suggestion, use another shipping company if you would like your items delivered. FedEx does not even take responsibility or apologize.","December 20th, 2017",3,7,MJ r.,1.0,2021-05-30 10:10:57.350553,2021-05-30 10:11:01.577675,FedEx,Sitejabber
506,ReviewRow-101,Fedex stoler item fom custcomer,"My name is Tony and I have recently shipped a item out. I left the object at the rail, the lady told me to just leave it and she will scan it since there were a lot of people and it was about to close. The box had a label saying Lst-Rees Laser. I waited 3 weeks and the customer said they did not recieve it and the tracker said it was not moving. I went to complain and I told them that the item was $1,489.95 and they said that I should go to 696 E. Trimble to complain. When I went to this address they told me to go home and wait. They took my contact info and they still never called me back. I came again 6 weeks after to complain and they said the delivery guy did not pick it up. Do you think that any company would steal something? I don't know who would take my item. They did not even scan the box when I first came.(i think all employee stoler","November 16th, 2017",2,1,tony n.,1.0,2021-05-30 10:11:01.577675,2021-05-30 10:11:04.822658,FedEx,Sitejabber
507,ReviewRow-65,Created a hazard,"I had ordered a metal and glass bookcase which was to be 55 pounds. I asked that FedEx make sure I was home before they left it since I have a bad back. I made plans to have someone here on the scheduled date of delivery. HOWEVER, it was delivered 4 days early and just left lying ACROSS my doorway creating a hazard and also making it difficult for me to get in and out of my apartment. I called FedEx as it had only been minutes since I had seen the truck pulling away (he had not made sure I was home) and asked that they have the driver come back and move it. Her response was ""call the company that you ordered it from"". WHAT did she think they were going to do? I even said to her that the driver did not follow directions and had created a hazard in the event of a fire or something and I either had to get in or out in a hurry. She did not care and hung up on me! Why can we not chose who will be making deliveries - except that UPS is not any better! If you are a senior citizen like myself, what are you to do?","August 29th, 2016",9,12,Carol N.,1.0,2021-05-30 10:11:04.822658,2021-05-30 10:11:09.084204,FedEx,Sitejabber
508,ReviewRow-161,Is there an end of the year contest for who can tell the biggest lie to a customer?,"This has been so frustrating. I now see why FedEx has a one-star rating. I would give it a zero if possible. I tried to sign up for Delivery Manager on the FedEx website. I did this THREE TIMES on the advice of reps. It doesn't recognize my username or password, it won't send an email to reset the password, it doesn't recognize security questions, when it does give the right question, it doesn't recognize the correct answer. I am not an idiot. I write down all of this info. It asks security questions for someone else. I don't know those people, I have never lived at those addresses. When I called customer service over a 3 day period, I had reps blatantly lie to me. They seemed to think this was funny. This was verified by another rep (who said the other guy had lied because he didn't want to help me) and a supervisor (who admitted that nothing I had been told was true). I was told that I did not live at my address (I have lived here since 2010 and FedEx has delivered numerous packages here). I was told that the post office said I didn't live here (the post office keeps no database and has been delivering mail here since 2010). I was told that the post office would have to verify my address and send that to FedEx (the post office says that is a complete lie and they have never done such a thing). I was told to go to the station manager of my local FedEx to fix this (another lie. They can do nothing). An agent told me he couldn't hear me (everyone at FedEx could but him but he blamed me and my phone). He kept asking me to speak louder until I was shouting. He seemed to think this was funny. I asked to speak with Tech Support. They say that they cannot help. They claim that Delivery Manager is run by a third party but will not identify that third party or how to contact them. When on the FedEx website, you are not directed to a third party to use Delivery Manager. This means it is FedEx and it is their responsibility. DELIVERY MANAGER DOESN'T WORK, NO ONE AT FEDEX CAN FIX IT AND NO ONE WILL TAKE RESPONSIBILITY OR HELP. Delivery Manager kept saying it couldn't identify me but when I asked for a code to be mailed to me, OMG, IT KNEW WHO I WAS. This is the worst customer service that I have ever encountered. This is worse than Amazon and I thought that was impossible.","December 31st, 2018",8,26,Letitia R.,1.0,2021-05-30 10:11:09.084204,2021-05-30 10:11:13.321484,FedEx,Sitejabber
509,ReviewRow-359,Nightmare!,"Nightmare! Obercharging, mixing orders up, double number of parcels, do not take any responsibility for their actions, ignoring clients. Recently removed option to communicate to customer service. OverValue items for custom declaration taking figures of the ceiling not allowing to correct by more than 30% that is a joke when the declared value to custom was 4 times higher than transaction fee. DO NOT use this company! This is scam!","January 6th, 2014",1,8,Piotr F.,1.0,2021-05-30 10:11:13.321484,2021-05-30 10:11:15.612266,FedEx,Sitejabber
