,author_id,title,reviews,date,total_reviews_written,upvote,reviewer_name,ratings,start_time,end_time,companyName,scraped_site
221,ReviewRow-615,The worst customer service I have ever experienced. Time and time again,"Wow - it just keeps getting worse. Tracking agents are likely outsourced overseas creating a huge language barrier. I just had to give my tracking number ten times then hang up on him after 20 minutes because he could not understand me and I could not understand him. This is at least the 4th time I've encountered this problem this year so I feel inclined to share my experience at this point. Bless the poor reps heart for trying to help me out but Fedex is clearly not doing quality control, training and/or qualifying these people to make sure that they can adequately do the job. SHAME ON FEDEX for putting people in this situation. I was calling because Fedex has lost my shipment for a second time. I finally called after the re-shipment from Wayfiar had not been updated in over a week. I asked to be transferred several times before hanging up and trying back. The woman who helped me next was a bit better but when I asked her why I could not be transferred to a manager to share my concerns, she let me know that they are not permitted to do that. They are literally NOT permitted to provide quality customer service because sometimes that's what it takes. I then was transferred to ""Customer Service"" instead of a package tracking agent and after I explained what was going on to this person (who sounded like they were here in the U.S.) they sounded totally unprepared, nervous and immediately transferred me to claims instead of communicating with me. Fedex clearly sets zero standards for customer care. I will go out of my way to shop with vendors who do not use Fedex from this point forward. Shame on you Fedex. Lost packages and incompetent staff. There's no excuse for this.","November 23rd, 2020",1,0,Jessica G.,1.0,2021-05-30 09:54:34.433877,2021-05-30 09:54:37.684365,FedEx,Sitejabber
222,ReviewRow-625,Is it here yet?,"The most unreliable and slowest among carriers! Don't commit to delivery date if you can't do it! Date keep on changing - adding a day, and after 3 days, added 2 more days! 5 day delay! And this is not the first time... 3rd time!","December 4th, 2020",1,0,Ali K.,1.0,2021-05-30 09:54:37.684365,2021-05-30 09:54:40.915568,FedEx,Sitejabber
223,ReviewRow-522,Don't ever use FedEx if possible liars and thieves,Don't ever use FedEx if possible liars and thieves. Let me start this way I own a business and I order a lot of stuff and whenever I see that Fed ex I will try to make a point to call and change that or I will cancel my order I have never had a good experience with Fed ex but I have also until recently not have FedEx deal for me and lied to me in the fashion they have done recently I ordered a pool that was supposed to be sent to my house they said it was delivered while I was at home they have no pictures they have nothing I don't have a pool there and when we went back to talk to them they said that they would have the driver call us the next day we have waited three days once we finally got back to them they said they don't know what happened to driver said he delivered it without a picture as everybody else does and if they can't find it to go back to the place we bought it from and tell them that it was lost. What pieces of $#*!. Their guy was supposed to call us back and he didn't I feel like the driver stole the package,"August 1st, 2020",1,0,Jason F.,1.0,2021-05-30 09:54:40.915568,2021-05-30 09:54:44.146290,FedEx,Sitejabber
224,ReviewRow-551,Bad deliveries,I have had orders from Walmart twice sent out. One of them got damaged in shipment never received it. Walmart Resent it and it come with half the order box was also damaged,"September 2nd, 2020",1,0,Steve L.,1.0,2021-05-30 09:54:44.146290,2021-05-30 09:54:46.344059,FedEx,Sitejabber
225,ReviewRow-746,Hanks must be on some island playing with my order.,"And maybe in a couple years a fedex truck will deliver it.
If they do deliver my packages they are usually in damaged boxes and in or near the street. I wonder sometimes if they just drive by and push my packages out the door.
UPS delivers to my door... hey fedex how come UPS can but you can't?","April 5th, 2021",2,1,Rand D.,1.0,2021-05-30 09:54:48.458382,2021-05-30 09:54:50.786039,FedEx,Sitejabber
226,ReviewRow-292,Highway robbers,"I paid 42 USD shipping (approx 60 CAD) to Canada for a $140 order, which is ridiculous enough on its own. I want to specify that I didn't order any large or bulky items; quite the opposite. In addition to this highway robbery shipping charge, FedEX now billed me an additional $53 CAD fee for duties, taxes and some weak BS called a ""brokerage fee."" Shouldn't your scammer fees be included in the upfront shipping cost? I've learned long ago to avoid UPS like the Bubonic plague for cross-border shipping, and now I'll be adding FedEx to the list of shame. Long live USPS and DHL!","May 25th, 2020",1,0,Traian P.,1.0,2021-05-30 09:54:50.786039,2021-05-30 09:54:53.019850,FedEx,Sitejabber
227,ReviewRow-694,Only want to deliver Covid vaccines to the government!,"Worst ever currier. Since pension plans changed and now more profitable delivering Covid vaccines, they never. NEVER deliver anything on time!","February 18th, 2021",1,0,Carlos C.,1.0,2021-05-30 09:54:53.019850,2021-05-30 09:54:56.254132,FedEx,Sitejabber
228,ReviewRow-750,Stolen merchandise,"2 packages sent from Winchester, Va to New Orleans on Fri 05MAR21. One arrives on Mon 08MAR21 and the other has been ""in transit"" at Holladay, Tn since Sat 06MAR21? F... ex has NO explanation or method for me to be recompensed for $300 loss. Not even rebate on $100 shipping fees!
Service:1
Value:1
Shipping:1
Returns:1","April 6th, 2021",1,0,Arnold C.,1.0,2021-05-30 09:54:56.254132,2021-05-30 09:54:59.637310,FedEx,Sitejabber
229,ReviewRow-713,Worst Service Ever,"Updated just now

Worst service EVER

FedEx customer service is dismal at best. They could care less about you. They have outsourced their customer service to the obvious low bidder who will tell you that they are trained... trained to brush you off. If you do have a problem with your shipment... its your fault for selecting the shipping method you did. What I was unaware of was their economy service gives FedEx the option to deliver themselves or pass it to USPS. My package arrived at my local hub, and then got shipped out of my state to be dropped off at a USPS facility where it got lost in the suffel. They could have at least dropped it at a local USPS facility. So what was supposed to be 5 ti 7 day delivery, took nearly a month to get my package. It is very clear that if you do not use the most expensive method, THEY DON'T CARE. Wish I could rate 0 star.","February 27th, 2021",1,0,JOHN B.,1.0,2021-05-30 09:54:59.637310,2021-05-30 09:55:02.012570,FedEx,Sitejabber
230,ReviewRow-285,Late delivery,I canceled my order online because FedEx won't send my package on time it's 3 days late. I am never going to order anything from this company ever again.,"May 13th, 2020",1,0,Christopher L.,1.0,2021-05-30 09:55:02.012570,2021-05-30 09:55:06.232279,FedEx,Sitejabber
231,ReviewRow-677,Terrible Fedex! Abusers of the Law!,"TERRIBLE! If I could have given no stars. Liars! Thieves! Fedex promised scheduled delivery on 1/20th but it arrived on 1/25th. FedEx is trying to blame 'no guarantee' on Covid 19 since March 2020. They abuse the policy by putting their interest before the client. They choose the worst route for the cargo from Beverly Hills to Memphis to Koeln in Germany to Cologne back to Koeln and then to Israel. There was no delay in custom. There was a delay in delivery just bc the route that was selected by FedEx making it cheaper for them knowing Consumers can make no claims for a refund. Well, I am going to dispute the charge and file a claim in Court. They are terrible!","January 27th, 2021",1,0,lauren p.,1.0,2021-05-30 09:55:06.232279,2021-05-30 09:55:08.498778,FedEx,Sitejabber
232,ReviewRow-785,Package Not Delivered,"I was expecting a package from FedEx. On the day it was scheduled to be delivered I didn't get it. The next day I got a notification that a deliver attempt was made but ""Customer Not Available."" Contacted FedEx because I was home and know for a fact the driver never came to my house. I was given the run around and told my package would be delivered the next day. I cancelled plans for the next day so I could be home to receive my package. Once again I got the same notification. And once again I know for a fact the driver never came to my house. Contacted FedEx once again and was assured the driver would be contacted and told to come back and deliver my package ASAP. I waited all day and still no package. Every time I contact FedEx I'm given the run around. Their customer service sucks. Each time I get the same cookie cutter response. They don't even address the fact that the driver states he tried to deliver my package when he didn't. Three days and still no package. I'm not sure if I will ever get my package at this point. If it were possible to give a negative review I would do so.","May 5th, 2021",1,1,Nona P.,1.0,2021-05-30 09:55:08.498778,2021-05-30 09:55:11.806018,FedEx,Sitejabber
233,ReviewRow-314,THE PACKAGES ARE LOST,IF I COULD GIVE YOU ANY STAR I WOULD DO THIS THIS IS A VERY RESPONSIBLE SHIPPING COMPANY THE PACKAGES ARRIVE AT YOUR HEADQUARTERS AND MISSING I MADE A PURCHASE IN THE MONTH OF MAY MY PACKAGE ARRIVED AT A FEDEX HEADQUARTERS IN KENESAW GEORGIA AND NEVER SALE IT WAS MY ADDRESS I CALLED THEM ON SEVERAL OCCASIONS DEMANDING A RESPONSE SINCE THE TRACK INDICATED THAT IT WAS FOUND AT ITS KENESAW HEADQUARTERS AND THEIR RESPONSE WAS SIMPLY LOST.,"June 29th, 2020",2,0,Jenny C.,1.0,2021-05-30 09:55:11.806018,2021-05-30 09:55:16.049931,FedEx,Sitejabber
234,ReviewRow-581,FEDEX - PHEW,"I1) I 76 years old and handicapped, at the end of a long corridor on the far side of a security door, and the entry buzzer doesn't work. I was not told that Fedex needed a signature for me to get my package, but it does.

Friday night I tried to call Fedex to change the rules or at least call me so I can open the door. It took 90 minutes before I could reach a human (the fedex robo kept asking stupid questions.) "" Call your shipper!"" the human said. Shipper said fedex makes those decisions and shipper can't change them. Yikes!

2) Fedex robo called me to say I would get the package today, Saturday. It is now 9:35 pm Saturday and no package. Apparently it hasn't even reached the couny line.

I will never, ever, ever deal with Fedex again! Before you do, look at their customer service ratings!

Apparently Fedex reserves the right to edit/remove these comments. Look at the disclaimer below ""photoes.""","October 10th, 2020",1,0,David W.,1.0,2021-05-30 09:55:16.049931,2021-05-30 09:55:18.309658,FedEx,Sitejabber
235,ReviewRow-631,Sad to see the demise of an American institution,"Good Lord - what has happened to FedEx in the past year (even preceding COVID)? They used to be the gold standard of shipping companies, but not any more. There is no way to contact a responsive human by phone (I couldn't tell if I was dealing with IVR or an actual person, but whoever it was could not follow what I was saying in short, simple phrases and distinct pronunciation). There is Zero feedback to email inquiries, and the delivery drivers now rank at the bottom of home delivery services in terms of quality and reliability. Hopefully Amazon will purchase FedEx before they go into bankruptcy, but if not, UPS has continuously been getting better, and Amazon Prime now seems to have a fleet of aircraft and delivery trucks. Sigh, another American institution that paved the way bites the dust through their own inattention and lack of care.","December 11th, 2020",1,0,Webe M.,1.0,2021-05-30 09:55:18.309658,2021-05-30 09:55:20.507894,FedEx,Sitejabber
236,ReviewRow-655,FedEx bad customer service,I have been waiting for a package since the 20th and have yet to receive my package! FedEx keeps giving me the run around on where my package is! I've called FedEx at least 6 times and every time the representative can't help resolve my issue they hang up the phone! First it was the package was not attempted to be delivered because of restrictions of location then it was it will be delivered Tuesday the 22nd didn't come now here it is Saturday the 26 and I still don't have my package. I drove to the location they said my package was and now they are saying the have no clue where my package is come on FedEx my sons whole day was ruined yesterday because he didn't have a gift to open for Christmas and I reassured him he would get his gift today because I myself was would pick the package up but FedEx cannot locate my package! I asked to speak to a supervisor they told me there was no one I could speak with! Do not send your packages through FedEx ground if you are in the Atlanta area,"December 26th, 2020",1,0,Primrose D.,1.0,2021-05-30 09:55:20.507894,2021-05-30 09:55:22.755016,FedEx,Sitejabber
237,ReviewRow-739,Fedex misses three delivery promises in a row,"This is the third day in a row that Fedex has not delivered as promised. When I pressed the representative, I was told it was promised tomorrow but it would probably be Friday. When I asked why wasn't I told that to begin with, she told me they really don't know when things will arrive. I won't use Fedex again.","March 31st, 2021",1,0,Karen K.,1.0,2021-05-30 09:55:22.755016,2021-05-30 09:55:25.989749,FedEx,Sitejabber
238,ReviewRow-795,Bad,I talk to the delivery person right at the time my package was supposedly delivered. I was told they did not have a package for me. Yet I get a delivered on my tracking. I also asked the driver is there a nother truck coming by and was told yes (nope no truck no delivery nothing. FedEx does not have customer service at least I wouldn't call it customer service,"May 17th, 2021",0,0,Charles M.,1.0,2021-05-30 09:55:25.989749,2021-05-30 09:55:29.228615,FedEx,Sitejabber
239,ReviewRow-711,Worst service ever. NEVER use Fedex,"They have now list two packages in two weeks. Their customer service people have hung up on me twice and refuse to let me talk to anyone who can get something done. They also refuse to refund my fee despite the fact they lost two pack
Service:1
Value:1
Shipping:1
Returns:1","February 26th, 2021",1,0,Brian H.,1.0,2021-05-30 09:55:29.228615,2021-05-30 09:55:33.617760,FedEx,Sitejabber
240,ReviewRow-544,FedEx Insurance is as worthless as worthless can possibly be!,"I had two packages that arrived in a two week period and the contents of both packages were broken. The boxes were not damaged so it is my guess that the boxes had been tossed/thrown onto a hard surface. I filed an online claim with FedEx and both claims were denied. One denial claimed that the package was not properly packaged by the seller when the package was not even looked at by an employee of FedEx. The other denial merely stated that the seller of the item would have to contact FedEx. I consider FedEx to be a worthless company. I will do my very best to never, ever, use the more than worthless FedEx again!

Shame, shame, and shame again on FedEx for being such a scam shipper!","August 28th, 2020",1,0,Steve T.,1.0,2021-05-30 09:55:33.617760,2021-05-30 09:55:36.828067,FedEx,Sitejabber
241,ReviewRow-565,Failed delivery. Failed tracking. Failed customer service,I stayed home for the delivery. None. FedEx reported on my email that it was delivered while I was sitting just on the other side of my front door! No delivery. The customer service is all out of the country and incompetent. They place you on hold and the call drops or goes to the survey then drops. I am sick of trying to resolve issues with foreigners who don't care and cut you off. No customer service at all. The summary above is stupid to say the main issue is customer service when the main issue is failed deliveries (drivers) and moron customer service out of the country refuse to handle tracking. Drivers appear to be thieves and customer service appears to be a fraud distraction.,"September 15th, 2020",1,0,P A.,1.0,2021-05-30 09:55:36.828067,2021-05-30 09:55:41.074530,FedEx,Sitejabber
242,ReviewRow-654,The worst shipping company,They have gave me 6 different delivery dates and failed through each time. If I ever order from a company using FedEx I will cancel. It's almost been a month and I have still not received my order.,"December 24th, 2020",1,0,Oumar W.,1.0,2021-05-30 09:55:41.074530,2021-05-30 09:55:45.372048,FedEx,Sitejabber
243,ReviewRow-307,Irresponsible deliveries,"FedEx is not responsible for any packages that they do not deliver or deliver incorrectly.
When you call to find out where your package was left, they simply refer you to the sender instead of asking the driver or checking the driver's GPS in order to find out where he might have mistakenly left the parcel.
This makes it far too easy for drivers to simply leave packages wherever they feel like in order to complete deliveries and get finished for the day. I understand that the drivers are probably pushed beyond reasonable limits which probably accounts for FedEx's unusual amount of undelivered or incorrectly delivered packages, but that is no excuse for the company's lack of consideration or responsibility.","June 20th, 2020",1,0,Jeffrey T.,1.0,2021-05-30 09:55:45.372048,2021-05-30 09:55:48.580284,FedEx,Sitejabber
244,ReviewRow-671,Crooks period.,"When fed x changes delivery date 3 times that means they stold your item ok. Take it from a person that knows first hand. Fed x will change your delivery date 3 or even 4 times for a dum reason. Big red flag dont let this go then they will say after they deliverd it. And youll say when because you canceled 3 times and fed x will pick a date and say that one. And you say. Um wher i never got it. Fed x will say. Ya we deliverd it. A big scam guys especaily fed x in bloomington they are crooks ther they steal nice items and give you alot of dates when you get package. Its just for confusion. So no more fed x ups is better. COMUNIST IS HERE
Service:1
Value:1
Shipping:1
Returns:1","January 19th, 2021",5,2,Henry c.,1.0,2021-05-30 09:55:48.580284,2021-05-30 09:55:50.937302,FedEx,Sitejabber
245,ReviewRow-792,Shipping is always delayed.,"FedEx struggles such that shipment dates always change, and are never on time. The expected or promised delivery dates are always pushed back to a later date. My last shipment was pushed back 3 times. Deliveries never show up at the specified time in their tracking. Nothing is ever on time. One shipment was even delivered to the wrong address once, even when the address was correct on the parcel. Not a fan of FedEx. This recent shipment was scheduled to show up on May 14th (today) but now it is delayed until May 15th. It might now even show up until the 18th given the patterns I have seen. It isn't worth the bother to trust tracking. They try, I grant them that, but I am not a fan. I prefer UPS.
Service:4
Value:3
Shipping:2
Returns:5","May 14th, 2021",1,0,Robert J.,2.0,2021-05-30 09:55:50.937302,2021-05-30 09:55:54.277242,FedEx,Sitejabber
246,ReviewRow-604,FedEx is the worst delivery service in the world!,"FedEx is the worst delivery service in the universe! I was supposed to have a package delivered today, and not only was it not delivered today, but nobody with their customer service department could tell me when it might be delivered. I signed up for text updates, but I didn't receive any information about the fact that it would not be delivered today. I had to logon to the website to find out that it wouldn't be delivered today. I spoke to customer service representatives and ask them if I could speak to their manager. Neither of them would even answer the question. So not only did they not let me speak to their manager, they would not even say yes or no to the question, may I speak to your manager. I don't know if that's just bad customer service or stupidity! I will never use FedEx for any of my delivery needs. I have had many bad experiences with FedEx in the past but this is my first review. I believe companies like this, should not exist. If you were not providing good service to the clients that are paying you, you should not exist!","November 7th, 2020",2,0,Matthew B.,1.0,2021-05-30 09:55:54.277242,2021-05-30 09:55:57.539228,FedEx,Sitejabber
247,ReviewRow-768,Awful,"They left without waiting for me to get down to where they were and sign the package. So i still haven't been able to receive my package.
Service:2
Value:3
Shipping:1
Returns:3","April 20th, 2021",1,0,mai s.,2.0,2021-05-30 09:55:57.539228,2021-05-30 09:56:01.891517,FedEx,Sitejabber
248,ReviewRow-752,I sent an item standard overnight. It took two days to arrive. Priority overnt... LATE.,I am done using FedEx. After two times of shipping an item-one standard overnight and the return at priority overnight... Both LATE. What the hell am I paying for?! Never Again!,"April 8th, 2021",1,0,Susan K.,1.0,2021-05-30 09:56:01.891517,2021-05-30 09:56:05.106751,FedEx,Sitejabber
249,ReviewRow-224,Fedex is a joke,Do not use you'll pay for insurance on your item then they will break them and denie your claim is ups 100% don't make mistakes I did fedex needs shut down,"December 4th, 2019",1,0,Christopher l.,1.0,2021-05-30 09:56:05.106751,2021-05-30 09:56:09.355656,FedEx,Sitejabber
250,ReviewRow-290,Worst service EVER,"I've been waiting for a package to be delivered by FedEx for over two weeks. It's taken 6 days to get to the city I live in from Indianapolis Indiana, a 3-hour drive. I was expecting my delivery today and I checked the email tracking update, and it said there was a ""delivery exception""(incorrect address apartment/suite number). I contacted customer service and they said that the address could not be found. I then asked what the problem was and the representative just repeated that the address could not be found, which is BS. I then asked the customer service representative if there was a location that I could pick up the package. They stated that due to it being a ""Smartpost""(haaa) package that it could not be picked up at a FedEx location. They told me to contact the original shipper of the package and have them contact FedEx with a correct address. I told them the address that you told me couldn't be found is the correct address. I contacted you original shipper and sadly they could not forward any sort of information to FedEx so my package will have to be shipped back to the original shipper and then I will get a refund to my account. FedEx is total BS. I've had two independent sources tell me just a few minutes ago that they saw the FedEx delivery truck drive through the complex parking lot where I live and the driver never even attempted to get out of the vehicle. As far as I'm concerned FedEx could go pound salt!","May 21st, 2020",1,0,Richard L.,1.0,2021-05-30 09:56:13.480249,2021-05-30 09:56:15.723975,FedEx,Sitejabber
251,ReviewRow-517,One more thing,"Why have a tracking site that never tracks anything? I have yet to see the site update prior to delivery and I mean many, many shipments. Useless as the staff!","July 29th, 2020",1,0,Joe A.,1.0,2021-05-30 09:56:15.723975,2021-05-30 09:56:17.997117,FedEx,Sitejabber
252,ReviewRow-614,Requesting delivery to a business during normal business hours was an unreasonable request,"So... after attempting delivery to a BUSINESS during NON-BUSINESS HOURS, I made a simple request that they actually try making the delivery to the business location during normal business hours. They said no.","November 22nd, 2020",1,0,Julia S.,1.0,2021-05-30 09:56:17.997117,2021-05-30 09:56:21.228105,FedEx,Sitejabber
253,ReviewRow-322,Always get my package undamaged.,"I don't get the hate here and I'm glad I don't.

I get shipments daily from the 3 carriers. FedEx, UPS and USPS.

FedEx always delivers at the same time, courteous drivers actually ring the bell and my boxes come without being beat up.

UPS is the worse for damage. I think they play soccer with every box I get. Horrible.

USPS sends my stuff all over the country for no reason. Even they don't understand it. Last package was 4 hours from my location. It took 13 days, went through 4 states and damaged the custom made parts in the package. Got stuck in the conveyor system.

So I can only say FedEx has never done any of that to me. They leave a message the day before it arrives as a reminder. Their racking is always updated. Package not damaged. What more should I expect.

Great service in my area.","July 8th, 2020",1,0,Jo S.,5.0,2021-05-30 09:56:21.228105,2021-05-30 09:56:23.481979,FedEx,Sitejabber
254,ReviewRow-595,Overnight shipments,Never got the package was due delivery by 12 noon never arrive pay for a service you dont get no one called or anything I called an still could get a answer on when it would be delivered will never use them again,"October 26th, 2020",1,0,Thomas J.,1.0,2021-05-30 09:56:23.481979,2021-05-30 09:56:27.733015,FedEx,Sitejabber
